{
  "kind": "Task",
  "id": "task_with_actions",
  "version": 1,
  "spec": {
    "rulesetRef": {
      "id" : "login_ruleset",
      "version" : 1
    },
    "resultType": "BOOLEAN",
    "actions": [
      { "on": "FAILURE", "emit": "LOCK_ACCOUNT" },
      { "on": "ALWAYS", "emit": "AUDIT_EVENT" }
    ],
    "description": "Login security task"
  }
}
